{
  "id": 500123,
  "name": "Spring Gala Dinner",
  "event_date": "2026-07-15",
  "start_time": "18:00",
  "end_time": "22:00",
  "status": "definite",
  "guest_count": 75,
  "location_id": 500123,
  "account_id": 500123,
  "created_at": "2026-06-03T14:30:00Z",
  "updated_at": "2026-06-03T14:30:00Z"
}